test/fixtures/saucedemo/03_www.saucedemo.com_inventory.html.locators.json

{"step":3,"url":"https://www.saucedemo.com/inventory.html","locators":[{"ctl":1,"by":"testid","value":"primary-header","score":98,"role":"generic","name":"","attr":"data-test"},{"ctl":2,"by":"role","value":"button","score":95,"role":"button","name":"Open Menu","locName":"Open Menu"},{"ctl":2,"by":"id","value":"react-burger-menu-btn","score":90,"role":"button","name":"Open Menu"},{"ctl":3,"by":"testid","value":"shopping-cart-link","score":98,"role":"link","name":"2","attr":"data-test"},{"ctl":3,"by":"role","value":"link","score":95,"role":"link","name":"2","locName":"2"},{"ctl":3,"by":"linkText","value":"2","score":75,"role":"link","name":"2"},{"ctl":3,"by":"css","value":"a[href*=\"cart.html\"]","score":60,"role":"link","name":"2"},{"ctl":4,"by":"testid","value":"shopping-cart-badge","score":98,"role":"generic","name":"2","attr":"data-test"},{"ctl":5,"by":"testid","value":"secondary-header","score":98,"role":"generic","name":"","attr":"data-test"},{"ctl":6,"by":"testid","value":"title","score":98,"role":"generic","name":"Products","attr":"data-test"},{"ctl":7,"by":"testid","value":"active-option","score":98,"role":"generic","name":"Name (A to Z)","attr":"data-test"},{"ctl":8,"by":"testid","value":"product-sort-container","score":98,"role":"combobox","name":"","attr":"data-test"},{"ctl":9,"by":"testid","value":"inventory-container","score":98,"role":"generic","name":"","attr":"data-test"},{"ctl":9,"by":"css","value":"#contents_wrapper > div:nth-child(3) > div:nth-child(1) > div:nth-child(1)","score":60,"role":"generic","name":""},{"ctl":10,"by":"testid","value":"inventory-list","score":98,"role":"generic","name":"","attr":"data-test"},{"ctl":11,"by":"css","value":"#contents_wrapper > div:nth-child(3) > div:nth-child(1) > div:nth-child(1) > div:nth-child(1) > div:nth-child(1)","score":60,"role":"generic","name":""},{"ctl":12,"by":"testid","value":"item-4-img-link","score":98,"role":"link","name":"","attr":"data-test"},{"ctl":12,"by":"id","value":"item_4_img_link","score":90,"role":"link","name":""},{"ctl":13,"by":"css","value":"#contents_wrapper > div:nth-child(3) > div:nth-child(1) > div:nth-child(1) > div:nth-child(1) > div:nth-child(1) > div:nth-child(2)","score":60,"role":"generic","name":""},{"ctl":14,"by":"testid","value":"item-4-title-link","score":98,"role":"link","name":"Sauce Labs Backpack","attr":"data-test"},{"ctl":14,"by":"role","value":"link","score":95,"role":"link","name":"Sauce Labs Backpack","locName":"Sauce Labs Backpack"},{"ctl":14,"by":"id","value":"item_4_title_link","score":90,"role":"link","name":"Sauce Labs Backpack"},{"ctl":14,"by":"linkText","value":"Sauce Labs Backpack","score":75,"role":"link","name":"Sauce Labs Backpack"},{"ctl":15,"by":"css","value":"#item_4_title_link > div:nth-child(1)","score":60,"role":"generic","name":"Sauce Labs Backpack"},{"ctl":16,"by":"css","value":"div:nth-child(3) > div:nth-child(1) > div:nth-child(1) > div:nth-child(1) > div:nth-child(1) > div:nth-child(2) > div:nth-child(1) > div:nth-child(2)","score":60,"role":"generic","name":""},{"ctl":17,"by":"css","value":"div:nth-child(3) > div:nth-child(1) > div:nth-child(1) > div:nth-child(1) > div:nth-child(1) > div:nth-child(2) > div:nth-child(2) > div:nth-child(1)","score":60,"role":"generic","name":"$29.99"},{"ctl":18,"by":"testid","value":"remove-sauce-labs-backpack","score":98,"role":"button","name":"Remove","attr":"data-test"},{"ctl":18,"by":"id","value":"remove-sauce-labs-backpack","score":90,"role":"button","name":"Remove"},{"ctl":18,"by":"name","value":"remove-sauce-labs-backpack","score":88,"role":"button","name":"Remove"},{"ctl":19,"by":"css","value":"#contents_wrapper > div:nth-child(3) > div:nth-child(1) > div:nth-child(1) > div:nth-child(1) > div:nth-child(2)","score":60,"role":"generic","name":""},{"ctl":20,"by":"testid","value":"item-0-img-link","score":98,"role":"link","name":"","attr":"data-test"},{"ctl":20,"by":"id","value":"item_0_img_link","score":90,"role":"link","name":""},{"ctl":21,"by":"css","value":"#contents_wrapper > div:nth-child(3) > div:nth-child(1) > div:nth-child(1) > div:nth-child(1) > div:nth-child(2) > div:nth-child(2)","score":60,"role":"generic","name":""},{"ctl":22,"by":"testid","value":"item-0-title-link","score":98,"role":"link","name":"Sauce Labs Bike Light","attr":"data-test"},{"ctl":22,"by":"role","value":"link","score":95,"role":"link","name":"Sauce Labs Bike Light","locName":"Sauce Labs Bike Light"},{"ctl":22,"by":"id","value":"item_0_title_link","score":90,"role":"link","name":"Sauce Labs Bike Light"},{"ctl":22,"by":"linkText","value":"Sauce Labs Bike Light","score":75,"role":"link","name":"Sauce Labs Bike Light"},{"ctl":23,"by":"css","value":"#item_0_title_link > div:nth-child(1)","score":60,"role":"generic","name":"Sauce Labs Bike Light"},{"ctl":24,"by":"css","value":"div:nth-child(3) > div:nth-child(1) > div:nth-child(1) > div:nth-child(1) > div:nth-child(2) > div:nth-child(2) > div:nth-child(1) > div:nth-child(2)","score":60,"role":"generic","name":""},{"ctl":25,"by":"css","value":"div:nth-child(3) > div:nth-child(1) > div:nth-child(1) > div:nth-child(1) > div:nth-child(2) > div:nth-child(2) > div:nth-child(2) > div:nth-child(1)","score":60,"role":"generic","name":"$9.99"},{"ctl":26,"by":"testid","value":"remove-sauce-labs-bike-light","score":98,"role":"button","name":"Remove","attr":"data-test"},{"ctl":26,"by":"id","value":"remove-sauce-labs-bike-light","score":90,"role":"button","name":"Remove"},{"ctl":26,"by":"name","value":"remove-sauce-labs-bike-light","score":88,"role":"button","name":"Remove"},{"ctl":27,"by":"css","value":"#contents_wrapper > div:nth-child(3) > div:nth-child(1) > div:nth-child(1) > div:nth-child(1) > div:nth-child(3)","score":60,"role":"generic","name":""},{"ctl":28,"by":"testid","value":"item-1-img-link","score":98,"role":"link","name":"","attr":"data-test"},{"ctl":28,"by":"id","value":"item_1_img_link","score":90,"role":"link","name":""},{"ctl":29,"by":"css","value":"#contents_wrapper > div:nth-child(3) > div:nth-child(1) > div:nth-child(1) > div:nth-child(1) > div:nth-child(3) > div:nth-child(2)","score":60,"role":"generic","name":""},{"ctl":30,"by":"testid","value":"item-1-title-link","score":98,"role":"link","name":"Sauce Labs Bolt T-Shirt","attr":"data-test"},{"ctl":30,"by":"role","value":"link","score":95,"role":"link","name":"Sauce Labs Bolt T-Shirt","locName":"Sauce Labs Bolt T-Shirt"},{"ctl":30,"by":"id","value":"item_1_title_link","score":90,"role":"link","name":"Sauce Labs Bolt T-Shirt"},{"ctl":30,"by":"linkText","value":"Sauce Labs Bolt T-Shirt","score":75,"role":"link","name":"Sauce Labs Bolt T-Shirt"},{"ctl":31,"by":"css","value":"#item_1_title_link > div:nth-child(1)","score":60,"role":"generic","name":"Sauce Labs Bolt T-Shirt"},{"ctl":32,"by":"css","value":"div:nth-child(3) > div:nth-child(1) > div:nth-child(1) > div:nth-child(1) > div:nth-child(3) > div:nth-child(2) > div:nth-child(1) > div:nth-child(2)","score":60,"role":"generic","name":""},{"ctl":33,"by":"css","value":"div:nth-child(3) > div:nth-child(1) > div:nth-child(1) > div:nth-child(1) > div:nth-child(3) > div:nth-child(2) > div:nth-child(2) > div:nth-child(1)","score":60,"role":"generic","name":"$15.99"},{"ctl":34,"by":"testid","value":"add-to-cart-sauce-labs-bolt-t-shirt","score":98,"role":"button","name":"Add to cart","attr":"data-test"},{"ctl":34,"by":"id","value":"add-to-cart-sauce-labs-bolt-t-shirt","score":90,"role":"button","name":"Add to cart"},{"ctl":34,"by":"name","value":"add-to-cart-sauce-labs-bolt-t-shirt","score":88,"role":"button","name":"Add to cart"},{"ctl":35,"by":"css","value":"#contents_wrapper > div:nth-child(3) > div:nth-child(1) > div:nth-child(1) > div:nth-child(1) > div:nth-child(4)","score":60,"role":"generic","name":""},{"ctl":36,"by":"testid","value":"item-5-img-link","score":98,"role":"link","name":"","attr":"data-test"},{"ctl":36,"by":"id","value":"item_5_img_link","score":90,"role":"link","name":""},{"ctl":37,"by":"css","value":"#contents_wrapper > div:nth-child(3) > div:nth-child(1) > div:nth-child(1) > div:nth-child(1) > div:nth-child(4) > div:nth-child(2)","score":60,"role":"generic","name":""},{"ctl":38,"by":"testid","value":"item-5-title-link","score":98,"role":"link","name":"Sauce Labs Fleece Jacket","attr":"data-test"},{"ctl":38,"by":"role","value":"link","score":95,"role":"link","name":"Sauce Labs Fleece Jacket","locName":"Sauce Labs Fleece Jacket"},{"ctl":38,"by":"id","value":"item_5_title_link","score":90,"role":"link","name":"Sauce Labs Fleece Jacket"},{"ctl":38,"by":"linkText","value":"Sauce Labs Fleece Jacket","score":75,"role":"link","name":"Sauce Labs Fleece Jacket"},{"ctl":39,"by":"css","value":"#item_5_title_link > div:nth-child(1)","score":60,"role":"generic","name":"Sauce Labs Fleece Jacket"},{"ctl":40,"by":"css","value":"div:nth-child(3) > div:nth-child(1) > div:nth-child(1) > div:nth-child(1) > div:nth-child(4) > div:nth-child(2) > div:nth-child(1) > div:nth-child(2)","score":60,"role":"generic","name":""},{"ctl":41,"by":"css","value":"div:nth-child(3) > div:nth-child(1) > div:nth-child(1) > div:nth-child(1) > div:nth-child(4) > div:nth-child(2) > div:nth-child(2) > div:nth-child(1)","score":60,"role":"generic","name":"$49.99"},{"ctl":42,"by":"testid","value":"add-to-cart-sauce-labs-fleece-jacket","score":98,"role":"button","name":"Add to cart","attr":"data-test"},{"ctl":42,"by":"id","value":"add-to-cart-sauce-labs-fleece-jacket","score":90,"role":"button","name":"Add to cart"},{"ctl":42,"by":"name","value":"add-to-cart-sauce-labs-fleece-jacket","score":88,"role":"button","name":"Add to cart"},{"ctl":43,"by":"css","value":"#contents_wrapper > div:nth-child(3) > div:nth-child(1) > div:nth-child(1) > div:nth-child(1) > div:nth-child(5)","score":60,"role":"generic","name":""},{"ctl":44,"by":"testid","value":"item-2-img-link","score":98,"role":"link","name":"","attr":"data-test"},{"ctl":44,"by":"id","value":"item_2_img_link","score":90,"role":"link","name":""},{"ctl":45,"by":"css","value":"#contents_wrapper > div:nth-child(3) > div:nth-child(1) > div:nth-child(1) > div:nth-child(1) > div:nth-child(5) > div:nth-child(2)","score":60,"role":"generic","name":""},{"ctl":46,"by":"testid","value":"item-2-title-link","score":98,"role":"link","name":"Sauce Labs Onesie","attr":"data-test"},{"ctl":46,"by":"role","value":"link","score":95,"role":"link","name":"Sauce Labs Onesie","locName":"Sauce Labs Onesie"},{"ctl":46,"by":"id","value":"item_2_title_link","score":90,"role":"link","name":"Sauce Labs Onesie"},{"ctl":46,"by":"linkText","value":"Sauce Labs Onesie","score":75,"role":"link","name":"Sauce Labs Onesie"},{"ctl":47,"by":"css","value":"#item_2_title_link > div:nth-child(1)","score":60,"role":"generic","name":"Sauce Labs Onesie"},{"ctl":48,"by":"css","value":"div:nth-child(3) > div:nth-child(1) > div:nth-child(1) > div:nth-child(1) > div:nth-child(5) > div:nth-child(2) > div:nth-child(1) > div:nth-child(2)","score":60,"role":"generic","name":""},{"ctl":49,"by":"css","value":"div:nth-child(3) > div:nth-child(1) > div:nth-child(1) > div:nth-child(1) > div:nth-child(5) > div:nth-child(2) > div:nth-child(2) > div:nth-child(1)","score":60,"role":"generic","name":"$7.99"},{"ctl":50,"by":"testid","value":"add-to-cart-sauce-labs-onesie","score":98,"role":"button","name":"Add to cart","attr":"data-test"},{"ctl":50,"by":"id","value":"add-to-cart-sauce-labs-onesie","score":90,"role":"button","name":"Add to cart"},{"ctl":50,"by":"name","value":"add-to-cart-sauce-labs-onesie","score":88,"role":"button","name":"Add to cart"},{"ctl":51,"by":"css","value":"#contents_wrapper > div:nth-child(3) > div:nth-child(1) > div:nth-child(1) > div:nth-child(1) > div:nth-child(6)","score":60,"role":"generic","name":""},{"ctl":52,"by":"testid","value":"item-3-img-link","score":98,"role":"link","name":"","attr":"data-test"},{"ctl":52,"by":"id","value":"item_3_img_link","score":90,"role":"link","name":""},{"ctl":53,"by":"css","value":"#contents_wrapper > div:nth-child(3) > div:nth-child(1) > div:nth-child(1) > div:nth-child(1) > div:nth-child(6) > div:nth-child(2)","score":60,"role":"generic","name":""},{"ctl":54,"by":"testid","value":"item-3-title-link","score":98,"role":"link","name":"Test.allTheThings() T-Shirt (Red)","attr":"data-test"},{"ctl":54,"by":"role","value":"link","score":95,"role":"link","name":"Test.allTheThings() T-Shirt (Red)","locName":"Test.allTheThings() T-Shirt (Red)"},{"ctl":54,"by":"id","value":"item_3_title_link","score":90,"role":"link","name":"Test.allTheThings() T-Shirt (Red)"},{"ctl":54,"by":"linkText","value":"Test.allTheThings() T-Shirt (Red)","score":75,"role":"link","name":"Test.allTheThings() T-Shirt (Red)"},{"ctl":55,"by":"css","value":"#item_3_title_link > div:nth-child(1)","score":60,"role":"generic","name":"Test.allTheThings() T-Shirt (Red)"},{"ctl":56,"by":"css","value":"div:nth-child(3) > div:nth-child(1) > div:nth-child(1) > div:nth-child(1) > div:nth-child(6) > div:nth-child(2) > div:nth-child(1) > div:nth-child(2)","score":60,"role":"generic","name":""},{"ctl":57,"by":"css","value":"div:nth-child(3) > div:nth-child(1) > div:nth-child(1) > div:nth-child(1) > div:nth-child(6) > div:nth-child(2) > div:nth-child(2) > div:nth-child(1)","score":60,"role":"generic","name":"$15.99"},{"ctl":58,"by":"testid","value":"add-to-cart-test-allthethings-t-shirt-red","score":98,"role":"button","name":"Add to cart","attr":"data-test"},{"ctl":58,"by":"id","value":"add-to-cart-test-allthethings-t-shirt-red","score":90,"role":"button","name":"Add to cart"},{"ctl":58,"by":"name","value":"add-to-cart-test-allthethings-t-shirt-red","score":88,"role":"button","name":"Add to cart"},{"ctl":59,"by":"testid","value":"social-twitter","score":98,"role":"link","name":"Twitter","attr":"data-test"},{"ctl":59,"by":"role","value":"link","score":95,"role":"link","name":"Twitter","locName":"Twitter"},{"ctl":59,"by":"linkText","value":"Twitter","score":75,"role":"link","name":"Twitter"},{"ctl":59,"by":"css","value":"a[href*=\"https://twitter.com/saucelabs\"]","score":60,"role":"link","name":"Twitter"},{"ctl":60,"by":"testid","value":"social-facebook","score":98,"role":"link","name":"Facebook","attr":"data-test"},{"ctl":60,"by":"role","value":"link","score":95,"role":"link","name":"Facebook","locName":"Facebook"},{"ctl":60,"by":"linkText","value":"Facebook","score":75,"role":"link","name":"Facebook"},{"ctl":60,"by":"css","value":"a[href*=\"https://www.facebook.com/saucelabs\"]","score":60,"role":"link","name":"Facebook"},{"ctl":61,"by":"testid","value":"social-linkedin","score":98,"role":"link","name":"LinkedIn","attr":"data-test"},{"ctl":61,"by":"role","value":"link","score":95,"role":"link","name":"LinkedIn","locName":"LinkedIn"},{"ctl":61,"by":"linkText","value":"LinkedIn","score":75,"role":"link","name":"LinkedIn"},{"ctl":61,"by":"css","value":"a[href*=\"https://www.linkedin.com/company/sauce-labs/\"]","score":60,"role":"link","name":"LinkedIn"},{"ctl":62,"by":"testid","value":"footer-copy","score":98,"role":"generic","name":"","attr":"data-test"}]}

test/fixtures/saucedemo/02_diff.md

## Added

+ #   - Name (A to Z) (selected)
+ #   - Name (Z to A)
+ #   - Price (high to low)
+ #   - Price (low to high)
+ - button "Add to cart" [dup 1/6]:
+ - button "Add to cart" [dup 2/6]:
+ - button "Add to cart" [dup 3/6]:
+ - button "Add to cart" [dup 4/6]:
+ - button "Add to cart" [dup 5/6]:
+ - button "Add to cart" [dup 6/6]:
+ - button "Open Menu":
+ - generic "$15.99" [dup 1/2]:
+ - generic "$15.99" [dup 2/2]:
+ - generic "$29.99":
+ - generic "$49.99":
+ - generic "$7.99":
+ - generic "$9.99":
+ - generic "Name (A to Z)":
+ - generic "Products":
+ - generic "Sauce Labs Backpack":
+ - generic "Sauce Labs Bike Light":
+ - generic "Sauce Labs Bolt T-Shirt":
+ - generic "Sauce Labs Fleece Jacket":
+ - generic "Sauce Labs Onesie":
+ - generic "Test.allTheThings() T-Shirt (Red)":
+ - generic:
+ - generic:
+ - generic:
+ - generic:
+ - generic:
+ - generic:
+ - generic:
+ - generic:
+ - generic:
+ - generic:
+ - generic:
+ - generic:
+ - generic:
+ - generic:
+ - generic:
+ - generic:
+ - generic:
+ - generic:
+ - generic:
+ - generic:
+ - generic:
+ - generic:
+ - img "Sauce Labs Backpack"
+ - img "Sauce Labs Bike Light"
+ - img "Sauce Labs Bolt T-Shirt"
+ - img "Sauce Labs Fleece Jacket"
+ - img "Sauce Labs Onesie"
+ - img "Test.allTheThings() T-Shirt (Red)"
+ - link "Facebook":
+ - link "LinkedIn":
+ - link "Sauce Labs Backpack":
+ - link "Sauce Labs Bike Light":
+ - link "Sauce Labs Bolt T-Shirt":
+ - link "Sauce Labs Fleece Jacket":
+ - link "Sauce Labs Onesie":
+ - link "Test.allTheThings() T-Shirt (Red)":
+ - link "Twitter":
+ - link:
+ - link:
+ - link:
+ - link:
+ - link:
+ - link:
+ - list
+ - listitem
+ - listitem
+ - listitem
+ - {by: css, value: "#contents_wrapper > div:nth-child(3) > div:nth-child(1) > div:nth-child(1) > div:nth-child(1) > div:nth-child(1) > div:nth-child(2)", stability: low, score: 60}
+ - {by: css, value: "#contents_wrapper > div:nth-child(3) > div:nth-child(1) > div:nth-child(1) > div:nth-child(1) > div:nth-child(1)", stability: low, score: 60}
+ - {by: css, value: "#contents_wrapper > div:nth-child(3) > div:nth-child(1) > div:nth-child(1) > div:nth-child(1) > div:nth-child(2) > div:nth-child(2)", stability: low, score: 60}
+ - {by: css, value: "#contents_wrapper > div:nth-child(3) > div:nth-child(1) > div:nth-child(1) > div:nth-child(1) > div:nth-child(2)", stability: low, score: 60}
+ - {by: css, value: "#contents_wrapper > div:nth-child(3) > div:nth-child(1) > div:nth-child(1) > div:nth-child(1) > div:nth-child(3) > div:nth-child(2)", stability: low, score: 60}
+ - {by: css, value: "#contents_wrapper > div:nth-child(3) > div:nth-child(1) > div:nth-child(1) > div:nth-child(1) > div:nth-child(3)", stability: low, score: 60}
+ - {by: css, value: "#contents_wrapper > div:nth-child(3) > div:nth-child(1) > div:nth-child(1) > div:nth-child(1) > div:nth-child(4) > div:nth-child(2)", stability: low, score: 60}
+ - {by: css, value: "#contents_wrapper > div:nth-child(3) > div:nth-child(1) > div:nth-child(1) > div:nth-child(1) > div:nth-child(4)", stability: low, score: 60}